{
  "schema": "claude-legal-audit.law-firm-value-chain.v1",
  "revision": "1.0.0",
  "status": "candidate",
  "use_policy": {
    "mode": "defensive_synthetic_only",
    "data_boundary": "public_sources_and_fictional_fixtures_only",
    "authority_boundary": "This model describes exposure and countercontrols; it neither authorizes data collection nor states that any provider performs the modeled acts.",
    "release_gate": "named_human_review_required"
  },
  "asset_planes": [
    {
      "plane_id": "PLANE-OPERATIONS",
      "name": "Operational and process ontology",
      "definition": "Workflow states, roles, queues, systems, task taxonomies, templates, approvals, economics, exceptions, and handoffs.",
      "boundary": "Process structure can be sensitive even when no document text is present; metadata combinations can identify matters or institutional priorities."
    },
    {
      "plane_id": "PLANE-JUDGMENT",
      "name": "Professional judgment ontology",
      "definition": "Issue framing, choices, risk weighting, fallbacks, escalation thresholds, edits, rationales, negotiation posture, and quality standards.",
      "boundary": "This is an operational representation of judgment, not a copy of a lawyer's mind and not proof that a choice was legally correct."
    },
    {
      "plane_id": "PLANE-CLIENT",
      "name": "Client and matter content",
      "definition": "Identities, facts, communications, evidence, drafts, objectives, advice, personal data, financial information, and prospective-client information.",
      "boundary": "Information relating to a representation is broader than attorney-client privilege; privilege, work product, confidentiality, privacy, and trade secret rules remain distinct."
    },
    {
      "plane_id": "PLANE-PUBLIC",
      "name": "Public-derived legal evidence",
      "definition": "Dockets, filed documents, opinions, public deal and regulatory documents, biographies, and authorized public statements.",
      "boundary": "Public outputs show only selected visible conduct and cannot reveal sealed material, unfiled work, confidential settlements, abandoned strategies, or internal deliberation."
    },
    {
      "plane_id": "PLANE-GOVERNANCE",
      "name": "Economic and governance control plane",
      "definition": "Ownership, professional independence, policy authority, vendor rights, system custody, retention, deletion, audit, pricing, and capital-allocation decisions.",
      "boundary": "Ownership or partnership never implies unrestricted access, privilege waiver, secondary-use authority, or permission to direct professional judgment."
    }
  ],
  "sensitivity_classes": [
    {"class_id": "S0", "name": "Intentionally public", "release_rule": "May be used only with public-source provenance and an incompleteness statement."},
    {"class_id": "S1", "name": "Firm-internal operations", "release_rule": "Keep firm-controlled unless a named owner approves a bounded public abstraction."},
    {"class_id": "S2", "name": "Client-related metadata or personnel data", "release_rule": "Do not publish or externalize by default; combinations may re-identify people and matters."},
    {"class_id": "S3", "name": "Analysis, strategy, advice, or work product", "release_rule": "Treat as highly restricted and synthetic-only in this repository."},
    {"class_id": "S4", "name": "Crown-jewel or regulated material", "release_rule": "Exclude from this repository, including credentials, trust funds, sealed data, conflicts details, and consequential strategic material."}
  ],
  "stages": [
    {
      "stage_id": "LF-01",
      "name": "Market intelligence, business development, and referrals",
      "scope": "Prospects, panels, referrals, pitches, relationship ownership, rate proposals, and market positioning before a specific engagement.",
      "applicability": ["all", "firm_operations"],
      "artifacts": [
        {"artifact_id": "LF-A001", "name": "prospect and relationship graph", "asset_planes": ["PLANE-OPERATIONS", "PLANE-GOVERNANCE"], "sensitivity": "S2"},
        {"artifact_id": "LF-A002", "name": "pitch themes and rate proposal", "asset_planes": ["PLANE-JUDGMENT", "PLANE-GOVERNANCE"], "sensitivity": "S1"}
      ],
      "operational_signals": ["lead source", "referral route", "conversion", "response time", "relationship owner"],
      "judgment_signals": ["client fit", "market positioning", "relationship priority", "pitch framing"],
      "public_evidence_availability": "low",
      "defensive_controls": ["segregate CRM from matter systems", "aggregate analytics", "purpose-limit relationship data", "prohibit provider secondary use"],
      "does_not_prove": ["A pitch theme does not prove the firm's internal legal strategy or a provider's intent."],
      "jurisdiction_dependency": "Privacy, solicitation, and professional-conduct requirements vary by jurisdiction.",
      "source_ids": ["SRC-0033"],
      "next_stage_ids": ["LF-02"]
    },
    {
      "stage_id": "LF-02",
      "name": "Prospective-client contact and pre-intake",
      "scope": "Initial contact, problem summary, adverse parties, urgency, jurisdiction, and routing before a representation is accepted.",
      "applicability": ["all"],
      "artifacts": [
        {"artifact_id": "LF-A003", "name": "pre-intake record", "asset_planes": ["PLANE-OPERATIONS", "PLANE-CLIENT"], "sensitivity": "S3"},
        {"artifact_id": "LF-A004", "name": "preliminary issue and urgency classification", "asset_planes": ["PLANE-JUDGMENT", "PLANE-CLIENT"], "sensitivity": "S3"}
      ],
      "operational_signals": ["question order", "routing path", "abandonment", "response time", "escalation threshold"],
      "judgment_signals": ["facts sought first", "preliminary issue spotting", "urgency", "suitability"],
      "public_evidence_availability": "none",
      "defensive_controls": ["conflict-first intake", "collect only necessary information", "clear warnings", "short retention", "block unrestricted external-model free text"],
      "does_not_prove": ["An initial contact does not prove that a representation formed or that the preliminary classification was correct."],
      "jurisdiction_dependency": "Prospective-client duties and formation of the relationship are fact- and jurisdiction-dependent.",
      "source_ids": ["SRC-0033", "SRC-0038"],
      "next_stage_ids": ["LF-03"]
    },
    {
      "stage_id": "LF-03",
      "name": "Conflicts and eligibility clearance",
      "scope": "Entity and affiliate matching, adversity analysis, waivers, screens, ethical walls, and clearance decisions.",
      "applicability": ["all"],
      "artifacts": [
        {"artifact_id": "LF-A005", "name": "conflicts entity graph", "asset_planes": ["PLANE-OPERATIONS", "PLANE-CLIENT"], "sensitivity": "S4"},
        {"artifact_id": "LF-A006", "name": "clearance, waiver, and screen decision", "asset_planes": ["PLANE-JUDGMENT", "PLANE-GOVERNANCE"], "sensitivity": "S4"}
      ],
      "operational_signals": ["match rules", "review paths", "clearance time", "approval roles", "exception handling"],
      "judgment_signals": ["adversity", "material limitation", "consentability", "screening judgment"],
      "public_evidence_availability": "none",
      "defensive_controls": ["firm-controlled enclave", "strict need-to-know access", "query minimization", "immutable clearance audit", "no cross-customer learning"],
      "does_not_prove": ["A name match does not prove a conflict, and a cleared matter does not prove the absence of every conflict."],
      "jurisdiction_dependency": "Conflict, waiver, and screening rules vary by jurisdiction and matter type.",
      "source_ids": ["SRC-0033"],
      "next_stage_ids": ["LF-04"]
    },
    {
      "stage_id": "LF-04",
      "name": "Client acceptance and enterprise risk",
      "scope": "Accept-or-decline decisions, competence and capacity checks, sanctions or KYC review, credit, insurer, reputational, and strategic fit.",
      "applicability": ["all"],
      "artifacts": [
        {"artifact_id": "LF-A007", "name": "accept or decline decision", "asset_planes": ["PLANE-JUDGMENT", "PLANE-GOVERNANCE"], "sensitivity": "S3"},
        {"artifact_id": "LF-A008", "name": "enterprise risk classification", "asset_planes": ["PLANE-OPERATIONS", "PLANE-CLIENT", "PLANE-GOVERNANCE"], "sensitivity": "S3"}
      ],
      "operational_signals": ["approval topology", "decline categories", "turnaround", "exception rate"],
      "judgment_signals": ["risk appetite", "reputational fit", "strategic value", "competence and capacity assessment"],
      "public_evidence_availability": "low",
      "defensive_controls": ["separate compliance facts from strategic rationale", "minimize reason codes", "dual authorization", "firm-owned decision log"],
      "does_not_prove": ["A decline category does not establish the full reason, legal merit, or a firm's general policy."],
      "jurisdiction_dependency": "Sanctions, KYC, professional competence, and insurer requirements depend on governing rules and client facts.",
      "source_ids": ["SRC-0033", "SRC-0034"],
      "next_stage_ids": ["LF-05"]
    },
    {
      "stage_id": "LF-05",
      "name": "Engagement, scope, pricing, and client instructions",
      "scope": "Engagement terms, scope and exclusions, outside-counsel rules, budgets, fees, assumptions, and client instructions including approved AI use.",
      "applicability": ["all"],
      "artifacts": [
        {"artifact_id": "LF-A009", "name": "engagement and scope policy", "asset_planes": ["PLANE-CLIENT", "PLANE-GOVERNANCE"], "sensitivity": "S3"},
        {"artifact_id": "LF-A010", "name": "fee and budget model", "asset_planes": ["PLANE-OPERATIONS", "PLANE-JUDGMENT", "PLANE-GOVERNANCE"], "sensitivity": "S3"}
      ],
      "operational_signals": ["negotiation cycles", "standard deviations", "approval thresholds", "budget changes"],